{
  "$schema": "https://json-schema.org/draft/2020-12/schema",
  "$id": "https://schemas.agent-ix.org/agent-ix/spec-artifacts-iso/StR.json",
  "type": "object",
  "properties": {
    "id": {
      "$ref": "https://schemas.agent-ix.org/agent-ix/spec-artifacts-iso/StRId.json"
    },
    "title": {
      "$ref": "https://schemas.agent-ix.org/agent-ix/spec-artifacts-iso/NonEmptyText.json"
    },
    "type": {
      "type": "string",
      "const": "StR"
    },
    "object": {
      "$ref": "https://schemas.agent-ix.org/agent-ix/spec-artifacts-iso/ObjectTypeName.json"
    },
    "status": {
      "$ref": "https://schemas.agent-ix.org/agent-ix/spec-artifacts-iso/ArtifactStatus.json"
    },
    "relationships": {
      "type": "array",
      "items": {
        "$ref": "https://schemas.agent-ix.org/agent-ix/spec-artifacts-iso/Relationship.json"
      }
    },
    "provenance": {
      "$ref": "https://schemas.agent-ix.org/agent-ix/spec-artifacts-iso/Provenance.json"
    },
    "stakeholderNeed": {
      "$ref": "https://schemas.agent-ix.org/agent-ix/spec-artifacts-iso/Section.json"
    },
    "rationale": {
      "$ref": "https://schemas.agent-ix.org/agent-ix/spec-artifacts-iso/Section.json"
    },
    "validationCriteria": {
      "type": "array",
      "items": {
        "$ref": "https://schemas.agent-ix.org/agent-ix/spec-artifacts-iso/ValidationCriterion.json"
      },
      "minItems": 1
    },
    "stakeholders": {
      "$ref": "https://schemas.agent-ix.org/agent-ix/spec-artifacts-iso/Section.json"
    },
    "contextAndAssumptions": {
      "$ref": "https://schemas.agent-ix.org/agent-ix/spec-artifacts-iso/Section.json"
    },
    "stakeholderConstraints": {
      "$ref": "https://schemas.agent-ix.org/agent-ix/spec-artifacts-iso/Section.json"
    },
    "dependencies": {
      "$ref": "https://schemas.agent-ix.org/agent-ix/spec-artifacts-iso/Section.json"
    },
    "priorityAndRisk": {
      "$ref": "https://schemas.agent-ix.org/agent-ix/spec-artifacts-iso/Section.json"
    },
    "notes": {
      "$ref": "https://schemas.agent-ix.org/agent-ix/spec-artifacts-iso/Section.json"
    },
    "traceability": {
      "$ref": "https://schemas.agent-ix.org/agent-ix/spec-artifacts-iso/Section.json"
    }
  },
  "required": [
    "id",
    "title",
    "type",
    "relationships",
    "provenance",
    "stakeholderNeed",
    "rationale",
    "validationCriteria"
  ],
  "unevaluatedProperties": {
    "not": {}
  },
  "description": "Stakeholder requirement record (archetype `StR`)."
}
